{
  "type": "brewing:beverage",
  "schema_version": 1,
  "id": "brewing:absinthe/absinthe",
  "category": "spirit",
  "style": "absinthe",
  "container": "brewing:glass_flask",
  "rarity": "common",
  "stack_size": 16,
  "brewing": {
    "brew_time_seconds": 120,
    "brew_time_ticks": 2400,
    "station_tags": [
      "brewing:fermenter",
      "brewing:still",
      "brewing:infuser"
    ],
    "difficulty": 2,
    "batch_size_servings": 4,
    "byproducts": [],
    "failure": {
      "enabled": false
    }
  },
  "stats": {
    "alcohol_by_volume": 65.0,
    "strength": 1.0,
    "intoxication": {
      "value": 1.0,
      "decay_rate_per_tick": 0.001
    },
    "nutrition": {
      "hunger": 0,
      "saturation": 0.0
    }
  },
  "quality": {
    "tier": "standard",
    "supports_quality": true,
    "quality_on_brew": 0.5,
    "quality_floor": 0.2,
    "quality_ceiling": 0.9
  },
  "aging": {
    "supported": false
  },
  "spoilage": {
    "enabled": false
  },
  "carbonation": {
    "level": "none",
    "foam": {
      "enabled": false,
      "spill_chance_on_open": 0.0
    }
  },
  "visuals": {
    "liquid_color": 16765040,
    "bubbles": "none",
    "glow": "none",
    "particle": "minecraft:happy_villager"
  },
  "effects": [],
  "ingredients": [
    {
      "item": "brewing:rye",
      "count": 4
    },
    {
      "item": "brewing:yeast",
      "count": 1
    },
    {
      "item": "brewing:wormwood",
      "count": 2
    },
    {
      "item": "brewing:anise",
      "count": 1
    },
    {
      "item": "brewing:fennel",
      "count": 1
    }
  ],
  "tags": [
    "brewing:spirit",
    "brewing:absinthe",
    "brewing:distilled",
    "brewing:botanical"
  ],
  "loot": {
    "weight": 0,
    "tables": []
  },
  "gates": {
    "requires_feature_flag": "brewing:enabled",
    "requires_gamerule_true": "brewingEnabled"
  },
  "client": {
    "use_liquid_tint": true,
    "show_strength_line": true,
    "show_quality_line": true,
    "show_spoilage_hint": false,
    "show_alcohol_by_volume": true,
    "tooltip_theme": "default"
  },
  "text": {
    "name_key": "brewing.beverage.absinthe.absinthe.name",
    "lore_key": "brewing.beverage.absinthe.absinthe.lore",
    "tooltip_key": "brewing.beverage.absinthe.absinthe.tooltip",
    "effect_text_key": "brewing.beverage.absinthe.absinthe.effects",
    "brew_time_text_key": "brewing.beverage.absinthe.absinthe.brew_time",
    "ingredients_text_key": "brewing.beverage.absinthe.absinthe.ingredients",
    "container_text_key": "brewing.beverage.absinthe.absinthe.container",
    "rarity_text_key": "brewing.beverage.absinthe.absinthe.rarity",
    "category_text_key": "brewing.beverage.absinthe.absinthe.category",
    "flavor_text_key": "brewing.beverage.absinthe.absinthe.flavor",
    "warning_key": "brewing.beverage.absinthe.absinthe.warning",
    "crafting_instructions_key": "brewing.beverage.absinthe.absinthe.instructions"
  },
  "meta": {
    "display_name": "Absinthe"
  }
}
