{
  "type": "brewing:beverage",
  "schema_version": 2,
  "id": "brewing:chorus_bloom_gin",
  "category": "spirit",
  "style": "botanical_gin",
  "container": "brewing:glass_flask",
  "rarity": "rare",
  "stack_size": 12,
  "brew_time_seconds": 40,
  "brew_time_ticks": 800,
  "brewing": {
    "brew_time_seconds": 40,
    "brew_time_ticks": 800,
    "station_tags": ["brewing:distillation_stations"],
    "difficulty": 2,
    "batch_size_servings": 4,
    "byproducts": [
      {
        "item": "minecraft:bucket",
        "count": 1,
        "chance": 1.0
      }
    ],
    "failure": {
      "enabled": true,
      "base_fail_chance": 0.045,
      "outcome": "brewing:spoiled_spirit",
      "extra_effects": [
        {
          "effect": "minecraft:nausea",
          "duration": 120,
          "amplifier": 0,
          "chance": 0.3
        }
      ]
    }
  },
  "stats": {
    "alcohol_by_volume": 45.0,
    "strength": 0.62,
    "intoxication": {
      "value": 0.28,
      "decay_rate_per_tick": 0.001
    },
    "nutrition": {
      "hunger": 0,
      "saturation": 0.0
    }
  },
  "quality": {
    "tier": "AGED",
    "supports_quality": true,
    "quality_on_brew": 0.65
  },
  "aging": {
    "supported": true,
    "min_days": 3,
    "max_days": 30,
    "preferred_container_tags": ["brewing:barrels"],
    "quality_bonus_per_day": 0.01,
    "risk_per_day_open": 0.025
  },
  "spoilage": {
    "enabled": true,
    "base_decay_per_day": 0.012,
    "opened_decay_multiplier": 1.3,
    "temperature": {
      "preferred": "cool",
      "hot_decay_multiplier": 1.25,
      "cold_decay_multiplier": 0.9
    }
  },
  "carbonation": {
    "level": "none",
    "foam": {
      "enabled": false,
      "spill_chance_on_open": 0.0
    }
  },
  "visuals": {
    "liquid_color": 13144063,
    "bubbles": "none",
    "glow": "subtle",
    "particle": "minecraft:portal"
  },
  "effects": [
    {
      "effect": "minecraft:levitation",
      "duration": 160,
      "amplifier": 0,
      "chance": 1.0
    },
    {
      "effect": "minecraft:nausea",
      "duration": 100,
      "amplifier": 0,
      "chance": 0.3
    }
  ],
  "ingredients": [
    {
      "item": "minecraft:water_bucket",
      "count": 1
    },
    {
      "item": "brewing:rice",
      "count": 6
    },
    {
      "item": "brewing:kojimold",
      "count": 1
    },
    {
      "item": "minecraft:chorus_flower",
      "count": 2
    },
    {
      "item": "minecraft:sugar",
      "count": 1
    }
  ],
  "tags": [
    "brewing:alcoholic",
    "brewing:spirit",
    "brewing:end",
    "brewing:elven",
    "brewing:magical",
    "brewing:distilled"
  ],
  "loot": {
    "weight": 3,
    "tables": ["brewing:end_city", "brewing:festival"]
  },
  "gates": {
    "requires_feature_flag": "brewing:liquids",
    "requires_gamerule_true": "enableAlcoholEffects"
  },
  "client": {
    "use_liquid_tint": true,
    "show_strength_line": true,
    "show_quality_line": true,
    "show_spoilage_hint": true
  },
  "name_key": "item.brewing.chorus_bloom_gin",
  "lore_key": "item.brewing.chorus_bloom_gin.desc",
  "tooltip_key": "item.brewing.chorus_bloom_gin.tooltip",
  "effect_text_key": "item.brewing.chorus_bloom_gin.effect",
  "brew_time_text_key": "item.brewing.chorus_bloom_gin.brew_time",
  "ingredients_text_key": "item.brewing.chorus_bloom_gin.ingredients",
  "container_text_key": "item.brewing.chorus_bloom_gin.container",
  "rarity_text_key": "item.brewing.chorus_bloom_gin.rarity",
  "category_text_key": "item.brewing.chorus_bloom_gin.category",
  "flavor_text_key": "item.brewing.chorus_bloom_gin.flavor_text",
  "warning_key": "item.brewing.chorus_bloom_gin.warning",
  "crafting_instructions_key": "item.brewing.chorus_bloom_gin.crafting_instructions"
}
